{
  "code": "MLS-V03-0521",
  "language": "italiano",
  "languageName": "Italiano",
  "n": 521,
  "title": "Pasiva en tiempos compuestos",
  "level": "B2",
  "part": "Voz e impersonalidad — Voce e impersonalità",
  "chapter": "Voz pasiva y causativas — Voce passiva e costruzioni causative",
  "articleMarkdown": "#### En pocas palabras\n\nLa **passiva nei tempi composti** combina la pasiva con **essere + participio** y un tiempo verbal compuesto. En **La porta è stata chiusa dal custode**, **è stata** sitúa la acción en el passato prossimo y **chiusa** expresa la acción pasiva.\n\n#### Cómo funciona\n\nLa estructura puede verse como **forma compuesta de essere + participio del verbo principal**. Por ejemplo: **è stata chiusa**, **era stata chiusa**, **sarà stata chiusa**, **sia stata chiusa**, **sarebbe stata chiusa**.\n\nCon **essere**, los participios muestran concordancia con el sujeto pasivo. Se dice **Il documento è stato firmato**, **La lettera è stata firmata**, **I documenti sono stati firmati**, **Le lettere sono state firmate**.\n\nEl agente puede añadirse con **da**: **La porta è stata chiusa dal custode**. Como en otras pasivas, también puede omitirse si no es relevante: **La porta è stata chiusa alle otto**.\n\nLa construcción permite expresar relaciones temporales más complejas. **Era stata chiusa** presenta una acción pasiva anterior a otro punto pasado; **sarà stata chiusa** puede situarla antes de una referencia futura o, según el contexto, expresar una inferencia.\n\n#### Ejemplos\n\n* **La porta è stata chiusa dal custode.** — passato prossimo pasivo con sujeto femenino singular.\n* **I documenti erano stati firmati prima della riunione.** — pluscuamperfecto pasivo y concordancia masculina plural.\n* **Le richieste saranno state esaminate entro domani.** — futuro compuesto pasivo.\n\n#### Observación importante\n\nLa definición heredada “muestra cuándo ocurre algo” es demasiado general. Esta entrada trata específicamente de **cómo se construyen los tiempos compuestos dentro de la voz pasiva**.\n\nTambién debe distinguirse de **venire + participio**, que se usa sobre todo en tiempos simples. Para expresar un compuesto como **è stata chiusa**, la construcción normal recurre a **essere**.\n\n#### Entradas relacionadas\n\n[0520. Complemento d'agente con da](#entrada-520) · [0522. Accordo del participio nella passiva](#entrada-522) · [0519. Andare + participio con valore di obbligo](#entrada-519) · [0518. Passiva con venire](#entrada-518)",
  "provider": "mls-r32",
  "model": "editorial-standard-32",
  "auditProvider": "mls-r32-validator",
  "auditModel": "chat-draft-973d1069232c523cd7b9c00fabfa9daad2d5b15bc6c7b8ce532f8ba89ec619b4",
  "promptVersion": "32.0",
  "generatedAt": "2026-09-19T06:10:27.233Z"
}
