{
  "code": "MLS-V05-0530",
  "language": "aleman",
  "languageName": "Alemán",
  "n": 530,
  "title": "Teilnehmen an + Dat",
  "level": "B1",
  "part": "Preposiciones y régimen — Präpositionen und Rektion",
  "chapter": "Régimen verbal y preposicional — Verb- und Präpositionalrektion",
  "articleMarkdown": "#### En pocas palabras\n\nLa construcción **teilnehmen an + Dativ** significa “participar en” algo. El complemento introducido por **an** aparece en dativo.\n\nEn **Ich nehme an dem Kurs teil**, el grupo **an dem Kurs** está en dativo.\n\n#### Cómo funciona\n\n**Teilnehmen** es un verbo separable. En una oración principal, la forma finita aparece en posición verbal y el prefijo **teil** se coloca al final: **Ich nehme an dem Kurs teil**.\n\nEl complemento con **an** expresa el acontecimiento, reunión, curso o contexto de participación. La preposición **an** rige aquí dativo: **an dem Kurs**, **an der Besprechung**, **an den Verhandlungen**.\n\nEn masculino y neutro singular aparece normalmente **dem**; en femenino, **der**; en plural, **den**. El caso afecta al grupo nominal completo y puede reflejarse también en adjetivos y determinantes.\n\nLa construcción puede aparecer con contracción: **an dem → am**, como en **Ich nehme am Kurs teil**.\n\n#### Ejemplos\n\n* **Ich nehme an dem Kurs teil.** — masculino singular dativo.\n* **Sie nimmt an der Sitzung teil.** — femenino singular dativo.\n* **Wir nehmen an den Gesprächen teil.** — plural dativo.\n* **Er nimmt am Wettbewerb teil.** — **am** = **an dem**.\n\n#### Observación importante\n\nLa preposición **an** puede regir acusativo o dativo en otros usos. En **teilnehmen an**, el régimen establecido es dativo.\n\nLa traducción española “participar en” no significa que **an** y “en” sean equivalentes fuera de esta construcción.\n\n#### Entradas relacionadas\n\n[Entrada 529: Sprechen über + Akk](#entry-529) · [Entrada 531: Warten auf + Akk](#entry-531) · [Entrada 532: Régimen abhängen von + Dat](#entry-532)",
  "provider": "mls-r32",
  "model": "editorial-standard-32",
  "auditProvider": "mls-r32-validator",
  "auditModel": "chat-draft-ff0480a41c1c9a2645e0055844d21b9b8764ce61d2f56459a40ef8b390c955e8",
  "promptVersion": "32.0",
  "generatedAt": "2026-09-19T08:16:49.361Z"
}
