{
  "code": "MLS-V10-0553",
  "language": "espanol-guatemala",
  "languageName": "Español de Guatemala",
  "n": 553,
  "title": "Clases de interjecciones atendiendo a su naturaleza gramatical",
  "level": "G1",
  "part": "Preposiciones, adverbios, conjunciones e interjecciones / Prepositions, adverbs, conjunctions, and interjections",
  "chapter": "Interjecciones / Interjections",
  "articleMarkdown": "#### En pocas palabras\n\nSegún su **naturaleza gramatical**, las interjecciones suelen dividirse en **propias** e **impropias**. Las propias funcionan básicamente como interjecciones; las impropias proceden de palabras pertenecientes a otras categorías que adquieren un uso interjectivo en determinados contextos.\n\nFormas como **¡ay!** o **¡uf!** son interjecciones propias. Expresiones como **¡bravo!**, **¡cuidado!** o **¡vamos!** proceden de otras clases de palabras, pero pueden funcionar interjectivamente.\n\n#### Cómo funciona\n\nLas **interjecciones propias** tienen como uso característico la función interjectiva. **Ay, uf, eh** y otras formas semejantes pueden constituir enunciados autónomos y no necesitan interpretarse como sustantivos, verbos o adjetivos dentro de una oración.\n\nLas **interjecciones impropias** nacen de palabras que conservan usos ordinarios en otras categorías. **¡Cuidado!** procede del sustantivo *cuidado*; **¡Bravo!** coincide con un adjetivo o sustantivo; **¡Vamos!** coincide formalmente con una forma del verbo *ir*.\n\nEn el uso interjectivo, estas formas pueden adquirir autonomía y un valor comunicativo especializado. **¡Cuidado!** funciona como advertencia completa aunque no contenga un verbo conjugado que exprese explícitamente una orden.\n\nEl origen categorial no obliga a que todos los rasgos de la palabra original sigan activos. En **¡Vamos!** usado para animar o apremiar, la interpretación puede alejarse del significado literal de desplazamiento del verbo *ir*.\n\nTambién existen **locuciones interjectivas**, formadas por varias palabras, como **¡Dios mío!**, **¡por favor!** o **¡madre mía!**. Su estructura interna es compleja, pero el conjunto puede funcionar como una unidad comunicativa autónoma.\n\nLa clasificación por naturaleza gramatical no describe directamente el significado. Una interjección propia puede expresar dolor, llamada o sorpresa; una impropia puede servir para advertir, animar, saludar o reaccionar. Esas funciones semánticas corresponden a otra clasificación.\n\n#### Ejemplos\n\n**¡Ay!** Es una interjección propia usada para expresar diversas reacciones según el contexto.\n\n**¡Uf!** Funciona característicamente como interjección y puede expresar cansancio, alivio o molestia.\n\n**¡Cuidado!** Es una interjección impropia procedente de un sustantivo y funciona como advertencia.\n\n**¡Vamos!** Puede funcionar como interjección impropia para animar, apremiar o reaccionar, además de sus usos verbales ordinarios.\n\n#### Observación importante\n\nLa clasificación **propia / impropia** se basa en el comportamiento y origen gramatical de las formas, no en la intensidad de la emoción ni en el tipo de reacción que expresan.\n\nAdemás, la frontera puede presentar casos discutibles porque algunas formas se han fijado históricamente en usos interjectivos. La entrada siguiente clasifica las interjecciones desde otro criterio: su significado o función comunicativa.\n\n#### Entradas relacionadas\n\n- [Entrada 552: Aspectos sintácticos](#entrada-552)\n- [Entrada 554: Clases de interjecciones atendiendo a su significado](#entrada-554)\n- [Entrada 551: Aspectos fónicos y gráficos](#entrada-551)\n- [Entrada 555: Interjecciones formularias](#entrada-555)",
  "provider": "mls-r32",
  "model": "editorial-standard-32",
  "auditProvider": "mls-r32-validator",
  "auditModel": "chat-draft-641cbd3a92f57213562470e75d362e4bef25f7a20478627dc96809e9656fa7ee",
  "promptVersion": "32.0",
  "generatedAt": "2026-09-14T12:42:40.219Z"
}
