{
  "code": "MLS-V07-0829",
  "language": "chino-taiwan",
  "languageName": "Chino mandarín de Taiwán",
  "n": 829,
  "title": "Partículas finales en interacciones docentes en línea",
  "level": "C1",
  "part": "Escrito, hablado e idiomaticidad — 書面、口語與慣用性",
  "chapter": "Mandarín escrito frente a hablado — 書面語與口語差異",
  "articleMarkdown": "#### En pocas palabras\n\nTseng y Yeong estudiaron partículas finales en interacciones en línea entre **15 docentes en formación** y **seis estudiantes de chino como segunda lengua** de Singapur, a través de cuatro sesiones que sumaron 24 clases. En ese corpus, las partículas aparecieron en el **15 % de los turnos estudiantiles** y el **37 % de los turnos de los docentes en formación**. La comparación de su muestra reporta una tasa 8 % mayor para los docentes taiwaneses que para los de China continental. Estos resultados describen ese contexto de enseñanza y no demuestran por sí solos que, en general, hablar use más partículas finales que escribir. (Tseng & Yeong, 2020)\n\n#### Referencias APA 7\n\n- Tseng, C. C., & Yeong, D. (2020). The use of utterance-final particles in Mandarin teaching. Chinese as a Second Language Research, 9(2), 259–275. https://doi.org/10.1515/caslar-2020-0010\n\n#### Entradas relacionadas\n\n- [Entrada 828: Habla usa más elipsis — 口語較多省略](#entry-828)\n- [Entrada 830: No escribir transcripción de fillers — 正式書寫避免口語填充詞](#entry-830)\n- [Entrada 831: 之 en escrito vs 的 en habla — 書面「之」與口語「的」](#entry-831)",
  "provider": "mls-r32",
  "model": "editorial-standard-32",
  "auditProvider": "mls-r32-validator",
  "auditModel": "chat-draft-4bcf851b1fb65c0426d66a14186cbfd4a82999438b76f60b6dc430c3862d57e0",
  "promptVersion": "32.0",
  "generatedAt": "2026-09-19T22:35:04.122Z"
}
