{
  "code": "MLS-V02-0781",
  "language": "portugues",
  "languageName": "Portugués brasileño",
  "n": 781,
  "title": "Subordinadas concesivas con embora",
  "level": "B1",
  "part": "Coordinación y subordinación — Coordenação e subordinação",
  "chapter": "Subordinación adverbial — Subordinação adverbial",
  "articleMarkdown": "#### En pocas palabras\n\nLas **subordinadas concesivas con embora** presentan una dificultad, circunstancia o expectativa que no impide lo expresado en la oración principal. En **Embora esteja chovendo, vou sair**, la lluvia podría favorecer quedarse en casa, pero la salida ocurre de todos modos.\n\nEn español suele corresponder a «aunque», «a pesar de que» o expresiones semejantes.\n\n#### Cómo funciona\n\n**Embora** introduce una relación concesiva: reconoce una circunstancia y muestra que el resultado principal se mantiene pese a ella. Es muy frecuente con subjuntivo: **Embora esteja cansado, ele continua trabalhando**.\n\nLa subordinada puede aparecer antes de la principal, posición muy común: **Embora fosse tarde, continuamos conversando**. También puede aparecer después: **Continuamos conversando, embora fosse tarde**. El orden modifica el foco y la organización discursiva, no la relación concesiva básica.\n\nEl tiempo del subjuntivo depende de la referencia temporal: **embora esteja**, **embora estivesse**, **embora tenha acontecido**. La elección no se reduce a una sola forma verbal.\n\n#### Ejemplos\n\n* **Embora esteja chovendo, vou sair.** — la lluvia no impide la salida.\n* **Embora estivesse cansada, ela terminou o trabalho.** — el cansancio se presenta como obstáculo insuficiente.\n* **Ele aceitou a proposta, embora tivesse dúvidas.** — las dudas no impidieron la aceptación.\n\n#### Observación importante\n\nEn portugués, **embora** se asocia fuertemente con el subjuntivo en este uso concesivo. No conviene transferir mecánicamente el patrón modal del español, porque las dos lenguas no distribuyen siempre indicativo y subjuntivo de la misma manera.\n\nAdemás, **embora** también aparece en la expresión **ir embora**, donde significa «irse» y no funciona como conjunción concesiva.\n\n#### Entradas relacionadas\n\n[779. Subordinadas causais com porque](#entrada-779) · [780. Subordinadas causais com já que](#entrada-780) · [782. Subordinadas concessivas com mesmo que](#entrada-782) · [783. Subordinadas condicionais com se](#entrada-783) · [685. Ordem em subordinadas](#entrada-685)",
  "provider": "mls-r32",
  "model": "editorial-standard-32",
  "auditProvider": "mls-r32-validator",
  "auditModel": "chat-draft-978e02941226159a4cfe04b2116fa414776aafe1ee7b95140440bfaaf7370d80",
  "promptVersion": "32.0",
  "generatedAt": "2026-09-18T06:41:33.511Z"
}
