{
  "code": "MLS-V02-0008",
  "language": "portugues",
  "languageName": "Portugués brasileño",
  "n": 8,
  "title": "Dígrafos qu y gu",
  "level": "A1",
  "part": "Sistema gráfico, pronunciación y fundamentos — Sistema gráfico, pronúncia e fundamentos",
  "chapter": "Escritura y ortografía — Escrita e ortografia",
  "articleMarkdown": "#### En pocas palabras\n\nEn portugués brasileño, **qu** y **gu** pueden funcionar como dígrafos delante de **e** o **i** cuando la letra **u no se pronuncia**. En esos casos, las dos letras ayudan a representar un solo sonido consonántico.\n\nPor ejemplo, en **queijo** se oye /k/ al inicio, y en **guerra** se oye /g/ antes de **e**.\n\n#### Cómo funciona\n\nLa letra **q** se escribe normalmente acompañada de **u**. En palabras como *queijo* y *quilo*, la secuencia **qu** representa el sonido /k/ y la **u** no tiene sonido propio.\n\nCon **g**, la combinación **gu** permite mantener el sonido /g/ delante de **e** o **i**: *guerra, guitarra*. Sin esa **u**, la letra **g** delante de esas vocales suele tener otro valor, como en *gelo* o *girafa*.\n\nSin embargo, no toda secuencia **qu** o **gu** es un dígrafo en sentido estricto. En palabras como **cinquenta** o **aguentar**, la **u** se pronuncia; por tanto, la secuencia representa más de un sonido.\n\n#### Ejemplos\n\n* **queijo** — *(queso)*  \n  **qu** representa /k/ y la **u** no se pronuncia.\n\n* **guerra** — *(guerra)*  \n  **gu** mantiene el sonido /g/ antes de **e**.\n\n* **guitarra** — *(guitarra)*  \n  **gu** representa /g/ antes de **i**, con **u** muda.\n\n#### Observación importante\n\nLa ortografía portuguesa actual ya no usa diéresis para señalar la **u** pronunciada en palabras como *linguiça* o *frequente*. La pronunciación se aprende con la palabra.\n\nPor eso, **qu/gu** son dígrafos solo cuando la **u** no representa un sonido independiente.\n\n#### Entradas relacionadas\n\n[6. Dígrafos ch, lh e nh](#entrada-6) · [7. Dígrafos rr e ss](#entrada-7) · [9. Uso de m e n para indicar nasalidade](#entrada-9) · [10. Grafias s, ss, c, ç, sc, sç e x para /s/](#entrada-10)",
  "provider": "mls-r32",
  "model": "editorial-standard-32",
  "auditProvider": "mls-r32-validator",
  "auditModel": "chat-draft-b680def4088f2b342c1b3d7ad9dc06ae14c36d23632ef6da0f7c79aea2c4d832",
  "promptVersion": "32.0",
  "generatedAt": "2026-09-17T21:53:32.327Z"
}
