{
  "code": "MLS-V01-0215",
  "language": "ingles",
  "languageName": "Inglés",
  "n": 215,
  "title": "Adverbios de grado",
  "level": "A2",
  "part": "Adjetivos, comparación y adverbios — Adjectives, comparison, and adverbs",
  "chapter": "Adverbios y adverbiales — Adverbs and adverbials",
  "articleMarkdown": "#### En pocas palabras\n\nLos **adverbios de grado** modifican la intensidad o extensión de una propiedad, una acción u otra expresión graduable. En **It’s extremely cold**, **extremely** indica un grado muy alto de frío.\n\nEntre los más frecuentes están **very, really, quite, too, enough, almost, extremely** y **completely**, pero no todos expresan el mismo tipo de grado ni ocupan la misma posición.\n\n#### Cómo funciona\n\nUn patrón frecuente es:\n\n**degree adverb + gradable expression**\n\nPueden modificar adjetivos: **very cold, extremely useful**; y otros adverbios: **very slowly, really well**. Algunos también modifican verbos o predicados: **I really like it**, **She almost finished**.\n\n**Too** suele indicar que el grado supera un límite adecuado o necesario: **The box is too heavy**. No equivale simplemente a **very**.\n\n**Enough** presenta una posición especial: suele ir después de un adjetivo o adverbio, como en **warm enough** o **quickly enough**.\n\n#### Ejemplos\n\n- **It’s extremely cold.** — Hace muchísimo frío.\n- **She speaks very quietly.** — Ella habla muy bajo.\n- **The box is too heavy.** — La caja es demasiado pesada.\n- **The room is warm enough.** — La habitación está lo bastante cálida.\n\n#### Observación importante\n\nLa combinación depende del significado de la palabra modificada. **Very** es natural con muchos adjetivos graduables, pero otros intensificadores se prefieren con propiedades que se interpretan como límites o extremos, como **completely empty** o **absolutely impossible**.\n\nLa posición también importa. **Really** puede modificar un verbo en **I really like it**, mientras **very** no suele usarse de esa manera: *I very like it* no es inglés estándar.\n\n#### Entradas relacionadas\n\n- [Entrada 214: Adverbios de frecuencia](#entry-214)\n- [Entrada 216: Adverbios de foco](#entry-216)\n- [Entrada 213: Adverbios de tiempo](#entry-213)",
  "provider": "mls-r32",
  "model": "editorial-standard-32",
  "auditProvider": "mls-r32-validator",
  "auditModel": "chat-draft-ec526a5b47709417f45697672fd5e37271b9843afd9415a5d3bd80f3a79817ab",
  "promptVersion": "32.0",
  "generatedAt": "2026-09-17T06:49:28.720Z"
}
