{
  "code": "MLS-V04-0938",
  "language": "frances",
  "languageName": "Francés",
  "n": 938,
  "title": "Conector d'ailleurs",
  "level": "B1",
  "part": "Morfología derivativa y cohesión — Morphologie dérivationnelle et cohésion",
  "chapter": "Conectores, cohesión y organización textual — Connecteurs, cohésion et organisation textuelle",
  "articleMarkdown": "#### En pocas palabras\n\n**D’ailleurs** sirve para **añadir una información o un argumento complementario** relacionado con lo que se acaba de decir. Según el contexto, puede traducirse como «además», «por cierto», «de hecho» o mediante otra formulación natural.\n\nEn **Je ne sortirai pas ; d’ailleurs, il pleut**, la lluvia aporta una razón adicional que refuerza la decisión de no salir: «No saldré; además, está lloviendo».\n\n#### Cómo funciona\n\n**D’ailleurs** puede introducir un argumento que confirma o refuerza una afirmación previa: **Cette solution est trop chère ; d’ailleurs, elle n’est pas disponible**. La segunda idea añade otro motivo en la misma dirección.\n\nTambién puede introducir una observación asociada o un pequeño cambio de perspectiva, próximo a «por cierto»: **J’ai parlé à Paul ; d’ailleurs, il te salue**. En este uso, la relación con lo anterior es menos argumentativa y más discursiva.\n\nSuele colocarse al comienzo del segmento añadido y separarse mediante coma. Es frecuente tanto en la lengua escrita como en la conversación.\n\n#### Ejemplos\n\n* **Je ne sortirai pas ; d’ailleurs, il pleut.** — No saldré; además, está lloviendo.\n* **Ce restaurant est fermé ; d’ailleurs, la lumière est éteinte.** — Este restaurante está cerrado; de hecho, la luz está apagada.\n* **Elle connaît bien le sujet ; d’ailleurs, elle a publié plusieurs articles.** — Conoce bien el tema; además, ha publicado varios artículos.\n* **J’ai vu Marc hier ; d’ailleurs, il m’a demandé de tes nouvelles.** — Vi a Marc ayer; por cierto, me preguntó por ti.\n\n#### Observación importante\n\nNo conviene asignar a **d’ailleurs** una sola traducción española. Su valor depende de si añade un argumento, confirma una idea o introduce una observación relacionada.\n\nSe distingue de **au demeurant**, que suele sonar más formal y presentar una observación complementaria o matiz con menos frecuencia en la conversación cotidiana.\n\n#### Entradas relacionadas\n\n[Conector au demeurant](#entry-937) · [Cependant](#entry-939) · [Conector or](#entry-936) · [Pourtant](#entry-940)",
  "provider": "mls-r32",
  "model": "editorial-standard-32",
  "auditProvider": "mls-r32-validator",
  "auditModel": "chat-draft-b4f6d98cf6d859ac93906d82629efec2ae024e7f8e0d8cff427afdc2d7bc43ff",
  "promptVersion": "32.0",
  "generatedAt": "2026-09-19T08:02:57.906Z"
}
