{
  "code": "MLS-V02-0796",
  "language": "portugues",
  "languageName": "Portugués brasileño",
  "n": 796,
  "title": "Subordinadas conformativas con segundo",
  "level": "B1",
  "part": "Coordinación y subordinación — Coordenação e subordinação",
  "chapter": "Subordinación adverbial — Subordinação adverbial",
  "articleMarkdown": "#### En pocas palabras\n\nLas **subordinadas conformativas con segundo** presentan una información de acuerdo con una fuente, una norma, una declaración o un punto de vista. En **Segundo informou a empresa, o serviço voltará amanhã**, la oración introducida por **segundo** establece la fuente de la información principal.\n\nEn español suele corresponder a «según», «conforme» o «de acuerdo con lo que».\n\n#### Cómo funciona\n\nCuando **segundo** introduce una oración con verbo, puede establecer el criterio o la fuente respecto de la cual se interpreta la principal: **Segundo determina o regulamento, o prazo é de dez dias**. La subordinada funciona como marco de conformidad.\n\nEl verbo aparece normalmente en indicativo cuando se reproduce una información, disposición o declaración presentada como existente: **Segundo explicou o diretor, haverá mudanças**. El tiempo verbal depende del momento de la declaración o de la norma citada.\n\nLa subordinada aparece con frecuencia al inicio y suele separarse por coma: **Segundo disseram os técnicos, o sistema está funcionando**. También puede integrarse en otras posiciones, aunque la anteposición es especialmente natural cuando introduce la fuente del mensaje.\n\n#### Ejemplos\n\n* **Segundo informou a empresa, o serviço voltará amanhã.** — la empresa funciona como fuente de la información.\n* **Segundo determina a lei, o documento deve ser público.** — la ley establece el criterio de conformidad.\n* **O resultado, segundo explicou a equipe, ainda é provisório.** — la explicación de la equipe enmarca la afirmación.\n\n#### Observación importante\n\nNo toda aparición de **segundo** introduce una subordinada. En **segundo o jornal**, no hay verbo y la expresión funciona como un grupo que indica fuente; en **o segundo capítulo**, **segundo** es un numeral ordinal.\n\n**Segundo** y **conforme** pueden introducir relaciones conformativas próximas. Sin embargo, **segundo** suele destacar especialmente la atribución de una información a una fuente o punto de vista, mientras **conforme** también es muy natural para expresar adecuación a una regla, acuerdo o manera.\n\n#### Entradas relacionadas\n\n[794. Subordinadas consecutivas com tanto... que](#entrada-794) · [795. Subordinadas conformativas com conforme](#entrada-795) · [797. Subordinadas proporcionais quanto mais... mais](#entrada-797) · [798. Subordinadas reduzidas de infinitivo](#entrada-798) · [685. Ordem em subordinadas](#entrada-685)",
  "provider": "mls-r32",
  "model": "editorial-standard-32",
  "auditProvider": "mls-r32-validator",
  "auditModel": "chat-draft-bc32fa67ee639e84c43c6435beac1636bd24116553f86841276d72c4568e7f6d",
  "promptVersion": "32.0",
  "generatedAt": "2026-09-18T06:50:23.748Z"
}
