{
  "code": "MLS-V09-0423",
  "language": "ruso",
  "languageName": "Ruso",
  "n": 423,
  "title": "нести/носить",
  "level": "B1",
  "part": "Movimiento — Глаголы движения",
  "chapter": "Verbos de movimiento sin prefijo — Глаголы движения без приставок",
  "articleMarkdown": "#### En pocas palabras\n\nLa tabla de Cornell incluye **нести / носить** como el par para llevar o cargar a pie: **нести** es one-way y **носить**, non-one-way. Esta ficha documenta la correspondencia y la glosa de la tabla.\n\n#### Entradas relacionadas\n\nConviene compararlos con **идти / ходить** para el movimiento del propio sujeto a pie, **везти / возить** para transportar en un vehículo y otros pares como **лететь / летать** o **плыть / плавать**, que muestran la misma oposición general entre trayecto concreto y movimiento habitual o multidireccional.",
  "provider": "mls-r32",
  "model": "editorial-standard-32",
  "auditProvider": "mls-r32-validator",
  "auditModel": "chat-draft-bb15dafd06e18d7cc0c80f3d45c9aab1d61e074b2d95c8d9c4a7a7d74f97d835",
  "promptVersion": "32.0",
  "generatedAt": "2026-09-19T09:16:14.724Z"
}
