{
  "code": "MLS-V03-0066",
  "language": "italiano",
  "languageName": "Italiano",
  "n": 66,
  "title": "Objeto indirecto",
  "level": "A2",
  "part": "Unidades y categorías gramaticales — Unità e categorie grammaticali",
  "chapter": "Clases de palabras y funciones sintácticas — Parti del discorso e funzioni sintattiche",
  "articleMarkdown": "#### En pocas palabras\n\nEl **complemento di termine** expresa normalmente la persona o entidad a la que se dirige algo, como una entrega, un mensaje o una comunicación. En **Ho dato il libro a Maria**, **a Maria** cumple esa función.\n\nNo debe identificarse automáticamente con cualquier beneficiario: depende de la estructura del verbo.\n\n#### Cómo funciona\n\nSuele aparecer introducido por **a**: **Scrivo a Luca**, **Do il libro a Maria**, **Racconto la storia ai bambini**.\n\nCon pronombres átonos se usan formas como **mi, ti, gli, le, ci, vi**: **Le ho dato il libro**. En italiano estándar, **le** representa aquí un complemento de término femenino singular.\n\nAlgunos verbos seleccionan otros complementos preposicionales que no son complemento di termine.\n\n#### Ejemplos\n\n* **Ho dato il libro a Maria.** — **a Maria** es complemento di termine.\n* **Scrivo a Paolo.** — **a Paolo** indica el destinatario de la escritura.\n* **Le telefono domani.** — **le** cumple función de complemento de término.\n\n#### Observación importante\n\nObjeto indirecto, destinatario y beneficiario son conceptos relacionados, pero no idénticos. El análisis sintáctico depende del verbo y de la construcción concreta.\n\n#### Entradas relacionadas\n\n[0065. Complemento oggetto diretto](#entrada-65) · [0067. Complemento predicativo](#entrada-67) · [0059. Pronome](#entrada-59)",
  "provider": "mls-r32",
  "model": "editorial-standard-32",
  "auditProvider": "mls-r32-validator",
  "auditModel": "chat-draft-b281824e493baf00ba9da23738cfe308144c6dc0e7b66e8254bad1c29dae414a",
  "promptVersion": "32.0",
  "generatedAt": "2026-09-19T05:03:04.130Z"
}
