{
  "code": "MLS-V05-0796",
  "language": "aleman",
  "languageName": "Alemán",
  "n": 796,
  "title": "Funktionsverbgefüge eine Entscheidung treffen",
  "level": "C1",
  "part": "Participios y formación de palabras — Partizipien und Wortbildung",
  "chapter": "Formación de palabras, compuestos y nominalización — Wortbildung, Komposita und Nominalisierung",
  "articleMarkdown": "#### En pocas palabras\n\n**Eine Entscheidung treffen** es un **Funktionsverbgefüge**, una combinación relativamente fija en la que un sustantivo aporta gran parte del contenido léxico y el verbo tiene un significado más general. La expresión completa significa “tomar una decisión” y se relaciona estrechamente con el verbo simple **entscheiden**.\n\nEn **Wir müssen heute eine Entscheidung treffen**, el sustantivo **Entscheidung** nombra el proceso de decidir y **treffen** forma con él una unidad predicativa establecida.\n\n#### Cómo funciona\n\nLa estructura habitual es **eine Entscheidung treffen**. **Entscheidung** aparece como grupo nominal en acusativo y puede modificarse: **eine wichtige Entscheidung treffen**, **die endgültige Entscheidung treffen**, **mehrere Entscheidungen treffen**. El verbo **treffen** se conjuga normalmente según la oración.\n\nEl significado global no se obtiene sumando mecánicamente “decisión” y los sentidos independientes de **treffen** como “encontrarse” o “acertar”. En esta combinación, **treffen** funciona como verbo ligero y la unidad completa expresa el acto de decidir.\n\nLa construcción es frecuente tanto en alemán general como en registros formales. Puede alternar con **entscheiden**, pero las dos formas no son idénticas en estructura ni siempre en organización informativa. El grupo nominal permite añadir determinantes y adjetivos que caracterizan la decisión de manera directa.\n\n#### Ejemplos\n\n* **Wir müssen heute eine Entscheidung treffen.** — Tenemos que tomar una decisión hoy.\n* **Die Kommission hat eine endgültige Entscheidung getroffen.** — La comisión tomó una decisión definitiva.\n* **Sie trifft wichtige Entscheidungen sehr schnell.** — Ella toma decisiones importantes muy rápidamente.\n* **Wir entscheiden morgen darüber.** — Decidiremos sobre ello mañana. Aquí aparece la alternativa verbal simple.\n\n#### Observación importante\n\nNo toda combinación de sustantivo y verbo constituye un **Funktionsverbgefüge**. En estas expresiones existe cierto grado de fijación léxica y un reparto particular del significado entre el nombre y el verbo.\n\nAdemás, **eine Entscheidung treffen** y **entscheiden** pueden ser próximos semánticamente sin ser sustitutos perfectos en cualquier contexto. La forma nominal puede destacar la decisión como entidad y admitir modificadores que no se trasladan de la misma manera al verbo simple.\n\n#### Entradas relacionadas\n\n[Entrada 795: Estilo verbal vs nominal — Verbalstil vs. Nominalstil](#entry-795) · [Entrada 797: Genitivos encadenados — Genitivs encadenados](#entry-797) · [Entrada 794: Durchführung der Untersuchung — Durchführung der Untersuchung](#entry-794) · [Entrada 798: Nominalización de adjetivos — Nominalisierung de adjetivos](#entry-798)",
  "provider": "mls-r32",
  "model": "editorial-standard-32",
  "auditProvider": "mls-r32-validator",
  "auditModel": "chat-draft-a98f52c059027eac3200b2d10d3161e148b3d9d8bf4246efac25d7ec913ac4d7",
  "promptVersion": "32.0",
  "generatedAt": "2026-09-19T08:38:16.167Z"
}
