{
  "code": "MLS-V02-1154",
  "language": "portugues",
  "languageName": "Portugués brasileño",
  "n": 1154,
  "title": "Tirar frente a tirar",
  "level": "A2",
  "part": "Contraste Guatemala–Brasil y dominio avanzado C1–C2 — Contraste Guatemala–Brasil e domínio avançado C1–C2",
  "chapter": "Contraste español de Guatemala–portugués de Brasil — Contraste espanhol da Guatemala–português do Brasil",
  "articleMarkdown": "#### En pocas palabras\n\nEl portugués brasileño **tirar** tiene sentidos que coinciden solo en parte con los documentados para el español **tirar**. Michaelis registra para el portugués usos como quitar, obtener una nota, tomar fotografías y *tirar uma dúvida* («aclarar una duda»). El DLE registra para el español, entre otros, «dejar caer», «arrojar o lanzar» y «desechar». La traducción depende de la construcción y del contexto.\n\n#### Cómo funciona\n\nEn portugués brasileño, Michaelis documenta, por ejemplo:\n\n* **Tirei as meias por causa do calor.** — quitarse las medias.\n* **Tirei uma ótima nota no concurso.** — obtener una nota.\n* **Ela tirou fotos belíssimas.** — tomar fotografías.\n* **Tirar uma dúvida** — aclarar algo que no se había entendido bien.\n\nEn el DLE, el verbo español **tirar** incluye los sentidos de dejar caer algo intencionadamente, arrojar o lanzar en una dirección y desechar. Esos sentidos no describen por sí solos todos los usos de la palabra en español ni todos los del portugués.\n\n#### Observación importante\n\nNo traduzcas el verbo aislado: identifica el complemento y la acepción. En estos ejemplos, **tirar** puede corresponder a «quitar», «obtener», «tomar» o «aclarar», mientras que los sentidos españoles citados incluyen «lanzar» y «desechar».\n\n#### Entradas relacionadas\n\n[1155. Puxar frente a empujar](#entrada-1155) · [1029. Colocação ficar com](#entrada-1029)",
  "provider": "mls-r32",
  "model": "editorial-standard-32",
  "auditProvider": "mls-r32-validator",
  "auditModel": "staging-a40f1bc58e90519dd5d2a8b043e19532bc3e197e03c6463d659c88d2906830c3",
  "promptVersion": "32.0",
  "generatedAt": "2026-10-10T20:20:00.690Z"
}
