{
  "code": "MLS-V07-0439",
  "language": "chino-taiwan",
  "languageName": "Chino mandarín de Taiwán",
  "n": 439,
  "title": "Reduplicación y tono delimitativo",
  "level": "A2",
  "part": "Reduplicación y cantidad verbal — 重疊與動量",
  "chapter": "Reduplicación y delimitación verbal/adjetival — 重疊與動作／性質的限量",
  "articleMarkdown": "#### En pocas palabras\n\nLa reduplicación verbal delimitativa del mandarín puede presentar un evento como de corta duración o de pequeña extensión. Lu y Müller (2026) ilustran este valor con **嘗嘗這道菜 (cháng-chang zhè dào cài)**, «prueba un poco este plato», frente a **嘗這道菜**, «prueba este plato».\n\n#### Alcance\n\nLa explicación de esta entrada se limita al valor delimitativo y al ejemplo analizado en §1 del estudio. La fuente consultada no valida afirmaciones sobre debilitamiento tonal o prosódico de la segunda sílaba.\n\n#### Entradas relacionadas\n\n- [Reduplicación no compatible con ciertos aspectos — 重疊與體貌限制](#entry-438)\n- [A一A — 動詞「A一A」](#entry-437)\n- [想一想 — 「想一想」](#entry-441)",
  "provider": "mls-r32",
  "model": "editorial-standard-32",
  "auditProvider": "mls-r32-validator",
  "auditModel": "chat-draft-0fd7bebcf7831a1293d093f6c245d4d971c6263b492a521d39271b7df64c86c2",
  "promptVersion": "32.0",
  "generatedAt": "2026-09-19T21:30:15.942Z"
}
