{
  "code": "MLS-V01-0174",
  "language": "ingles",
  "languageName": "Inglés",
  "n": 174,
  "title": "each other",
  "level": "A2",
  "part": "Pronombres y referencia — Pronouns and reference",
  "chapter": "Posesivos, reflexivos y recíprocos — Possessives, reflexives, and reciprocals",
  "articleMarkdown": "#### En pocas palabras\n**each other** es un pronombre recíproco. Se utiliza para indicar que dos o más personas realizan la misma acción de manera mutua; es decir, que la acción es intercambiable entre los participantes.\n\n#### Cómo funciona\nEn una oración, **each other** funciona como el objeto (la parte que recibe la acción del verbo o que sigue a una preposición). Se emplea para expresar que la acción fluye en ambos sentidos entre los sujetos, evitando tener que describir la acción dos veces.\n\nPor ejemplo, en lugar de decir que \"Juan saluda a María y María saluda a Juan\", se utiliza **each other** para indicar que el saludo es mutuo.\n\n#### Ejemplos\n* **They help each other.**\n  (Ellos se ayudan mutuamente / el uno al otro).\n* **We see each other at school.**\n  (Nos vemos en la escuela).\n* **They are talking to each other.**\n  (Ellos están hablando entre sí / el uno con el otro).\n\n#### Observación importante\nPara indicar posesión (que algo pertenece a la otra persona), se debe añadir un apóstrofo y una \"s\" (**each other's**). \n\n* **They held each other's hands.**\n  (Ellos se tomaron de las manos / sostuvieron las manos del otro).\n\nEs importante no confundirlo con los pronombres reflexivos (como *themselves*). Mientras que un reflexivo indica que la acción vuelve al mismo sujeto, **each other** requiere que la acción sea compartida o intercambiada entre personas distintas.\n\n#### Entradas relacionadas\n* Pronombres recíprocos\n* Pronombres de objeto",
  "provider": "cloudflare-gemma",
  "model": "@cf/google/gemma-4-26b-a4b-it",
  "auditProvider": "cloudflare-llama",
  "auditModel": "@cf/meta/llama-3.3-70b-instruct-fp8-fast",
  "promptVersion": "32.0",
  "generatedAt": "2026-09-17T10:43:14.465Z"
}
