{
  "code": "MLS-V03-0278",
  "language": "italiano",
  "languageName": "Italiano",
  "n": 278,
  "title": "Avere",
  "level": "A1",
  "part": "Sistema verbal: presente — Sistema verbale: presente",
  "chapter": "Verbos irregulares, serviles y frecuentes — Verbi irregolari, servili e frequenti",
  "articleMarkdown": "#### En pocas palabras\n\n**Avere** es el verbo italiano básico para expresar posesión y muchas relaciones de «tener». Su presente es irregular: **ho, hai, ha, abbiamo, avete, hanno**. En **Ho due fratelli e abbiamo un cane**, **ho** y **abbiamo** son formas de **avere**.\n\nTambién cumple una función fundamental como auxiliar.\n\n#### Cómo funciona\n\nComo verbo principal, **avere** aparece con posesiones y relaciones personales: **Ho una macchina**, **Abbiamo due figli**. También forma expresiones muy frecuentes como **avere fame, avere sete, avere paura, avere fretta**.\n\nEl presente es **io ho, tu hai, lui/lei ha, noi abbiamo, voi avete, loro hanno**. La **h** de **ho, hai, ha, hanno** es ortográfica y no se pronuncia.\n\nComo auxiliar, **avere** participa en numerosos tiempos compuestos: **ho mangiato**, **abbiamo visto**. La elección entre **avere** y **essere** depende del verbo y de la construcción.\n\n#### Ejemplos\n\n* **Ho due fratelli e abbiamo un cane.** — dos formas del presente de **avere**.\n* **Hai fame?** — expresión fija con **avere**.\n* **Hanno molto tempo.** — tercera persona plural.\n\n#### Observación importante\n\nEl italiano usa **avere** en varias expresiones donde el español suele usar «tener», pero la correspondencia no es total en todos los contextos.\n\nComo auxiliar, **avere** no expresa posesión: forma parte de un tiempo compuesto.\n\n#### Entradas relacionadas\n\n[0277. Essere](#entrada-277) · [0279. Sapere](#entrada-279) · [0276. Dovere](#entrada-276) · [0280. Conoscere](#entrada-280)",
  "provider": "mls-r32",
  "model": "editorial-standard-32",
  "auditProvider": "mls-r32-validator",
  "auditModel": "chat-draft-517fcf567e7f274f094a399263ed79a44c15f0da9518ed6ebede5f3d145d881d",
  "promptVersion": "32.0",
  "generatedAt": "2026-09-19T05:33:06.830Z"
}
