{
  "code": "MLS-V02-0097",
  "language": "portugues",
  "languageName": "Portugués brasileño",
  "n": 97,
  "title": "Sustantivos deverbales",
  "level": "A1",
  "part": "Sustantivos y sintagma nominal — Substantivos e sintagma nominal",
  "chapter": "Tipos de sustantivo y clasificación — Tipos de substantivo e classificação",
  "articleMarkdown": "#### En pocas palabras\n\nA nominalização deverbal pode preservar valência do verbo de origem; a expressão dos argumentos e as marcas nominais variam segundo fatores semânticos e pragmáticos.\n\n#### Evidencia de lectura\n\nNomes deverbais podem preservar a estrutura argumental do verbo de origem; a expressão dos argumentos depende de fatores pragmáticos, e a nominalização pode empregar marcação preposicional, modificação adjetival e possessivos.\n\n#### Entradas relacionadas\n\n[0096](#0096) · [0098](#0098)",
  "provider": "r33-local-source-followup",
  "model": "manual-primary-source-review",
  "auditProvider": "r33-local-canonical-assessment",
  "auditModel": "chat-draft-ec74ee95ca5a1c2d9b809ff0172a3afef4fefe7cc6de768a0985065992412c8f",
  "promptVersion": "32.0",
  "generatedAt": "2026-10-10T19:26:00.000Z"
}
