{
  "code": "MLS-V06-0619",
  "language": "japones",
  "languageName": "Japonés",
  "n": 619,
  "title": "〜ように manera",
  "level": "B1",
  "part": "Relaciones lógicas y temporales — 論理関係・時間関係",
  "chapter": "Finalidad, manera y estado — 目的・様態・状態",
  "articleMarkdown": "#### En pocas palabras\n\nLa explicación gramatical de la Fundación Japón incluye **私がやるようにやってください** y aclara que significa hacer algo **私がするやり方で** o **私のするとおりに**. La entrada se limita a **〜ように** como manera indicada por un modelo, con ese ejemplo directo.\n\n#### Localizador\n\nSección 8「例示」, explicación del ejemplo (22) 私がやるようにやってください (líneas 206–214).\n\n#### Fuentes\n\n- The Japan Foundation. (s. f.). 日本語教育通信 文法を楽しく よう(2). https://www.jpf.go.jp/j/project/japanese/teach/tsushin/grammar/201310.html\n\n#### Entradas relacionadas\n\n[Entrada 618: 〜ように finalidad — 「〜ように」目的](#entry-618) · [Entrada 620: 〜ようにする — 「〜ようにする」](#entry-620) · [Entrada 617: 〜まま — 「〜まま」](#entry-617) · [Entrada 621: 〜ようになる — 「〜ようになる」](#entry-621)",
  "provider": "mls-r32",
  "model": "editorial-standard-32",
  "auditProvider": "mls-r32-validator",
  "auditModel": "chat-draft-9bbaad133e1067b425db610ae1e05d66d72a1e3b2a33c7c3487986eddc038916",
  "promptVersion": "32.0",
  "generatedAt": "2026-09-19T09:09:38.626Z"
}
