{
  "code": "MLS-V03-0033",
  "language": "italiano",
  "languageName": "Italiano",
  "n": 33,
  "title": "Apostrofo y elisión",
  "level": "A1",
  "part": "Escritura, pronunciación y fundamentos — Scrittura, pronuncia e fondamenti",
  "chapter": "Ortografía y convenciones gráficas — Ortografia e convenzioni grafiche",
  "articleMarkdown": "#### En pocas palabras\n\nEl **apóstrofo** marca frecuentemente una **elisión**, es decir, la pérdida de una vocal final delante de otra palabra que empieza por vocal. Ejemplos comunes son **l'amica, l'uomo, un'amica**.\n\nLa elisión evita ciertas secuencias vocálicas y está regulada por convenciones ortográficas.\n\n#### Cómo funciona\n\nLos artículos **lo/la** pueden convertirse en **l'** ante vocal: **l'amico, l'amica**. El artículo indefinido femenino **una** se elide en **un'amica**, mientras el masculino **un amico** no lleva apóstrofo porque **un** no procede aquí de una elisión gráfica equivalente.\n\nOtras palabras también admiten elisión en contextos específicos.\n\n#### Ejemplos\n\n* **l'amico**\n* **l'amica**\n* **un'amica**\n* **d'accordo**\n\n#### Observación importante\n\nNo toda pérdida de sonidos finales se escribe con apóstrofo. El **troncamento** italiano puede eliminar parte de una palabra sin usarlo, como en **buon giorno**.\n\nPor eso conviene aprender el apóstrofo como parte de cada patrón ortográfico y no añadirlo automáticamente siempre que una forma parece abreviada.\n\n#### Entradas relacionadas\n\n[0036. Elisione con l' e un'](#entrada-36) · [0039. Troncamento senza apostrofo](#entrada-39)",
  "provider": "mls-r32",
  "model": "editorial-standard-32",
  "auditProvider": "mls-r32-validator",
  "auditModel": "staging-0f8aee9d58dd90092d09e4992732442300520518dcd0dbf1fd83e60429e7b747",
  "promptVersion": "32.0",
  "generatedAt": "2026-09-18T20:16:04.491Z"
}
