{
  "code": "MLS-V08-0370",
  "language": "coreano",
  "languageName": "Coreano",
  "n": 370,
  "title": "쓰고 있어요",
  "level": "A2",
  "part": "Aspecto y conexión básica — 상과 기본 연결",
  "chapter": "Aspecto, progresivo, resultado y experiencia — 상·진행·결과·경험",
  "articleMarkdown": "#### En pocas palabras\n\nLa guía *Sejong Korean 2* presenta **-고 있다** con verbos de vestir o llevar accesorios para describir el estado de tenerlos puestos; incluye **쓰다** y el ejemplo **모자를 쓰고 있어요** (국립국어원, 2013).\n\n#### Alcance\n\n**쓰다** tiene otros sentidos: con **글을 쓰다**, por ejemplo, **쓰고 있어요** puede describir una actividad en curso. La lectura depende del verbo y su complemento.\n\n#### Referencias APA 7\n\n국립국어원. (2013). *세종한국어 2 교원용 지침서*. https://www.korean.go.kr/common/download.do;front=052E464FB4F4D9E2EB12B90C4EBF3EC6?c_file_name=b29c6837-dee9-4f2a-918e-3f8edbb3c46a_0.pdf&file_path=reportData&o_file_name=%EC%84%B8%EC%A2%85%ED%95%9C%EA%B5%AD%EC%96%B4+2+%EA%B5%90%EC%9B%90%EC%9A%A9+%EC%A7%80%EC%B9%A8%EC%84%9C.pdf\n\n#### Entradas relacionadas\n\nSe relaciona con **V-고 있다**, **입고 있어요**, **앉아 있어요** y otras expresiones de estado mantenido.",
  "provider": "mls-r32",
  "model": "editorial-standard-32",
  "auditProvider": "mls-r32-validator",
  "auditModel": "chat-draft-c6e538e76d4be8dba8570abb5018fb82817f986ffc22a4b3d0da43f46dc51ee0",
  "promptVersion": "32.0",
  "generatedAt": "2026-09-19T09:36:35.477Z"
}
