{
  "code": "MLS-V09-0033",
  "language": "ruso",
  "languageName": "Ruso",
  "n": 33,
  "title": "Letra Юю",
  "level": "A1",
  "part": "Cirílico, pronunciación y ortografía — Кириллица, произношение и орфография",
  "chapter": "Alfabeto cirílico y nombres de las letras — Кириллица и названия букв",
  "articleMarkdown": "Según Gramota, ю puede representar у y señalar la suavidad de la consonante anterior (любит). Al inicio de palabra o después de vocal también puede representar [j] + vocal; la fuente ejemplifica южный y каюта. Su función depende de la posición.\n#### Fuentes (APA 7)\n\nГрамота.ру. (s. f.). Буквы а — я, у — ю. https://gramota.ru/biblioteka/spravochniki/pravila-russkoy-orfografii-i-punktuatsii/bukvy-a-ya-u-yu [https://gramota.ru/biblioteka/spravochniki/pravila-russkoy-orfografii-i-punktuatsii/bukvy-a-ya-u-yu]\n\n#### Entradas relacionadas\n\n*   [Letra Яя — я — Vocal iotada](#entry-34)\n*   [Letra Ее — е — Vocal iotada](#entry-32)\n*   [Letra Ёё — ё — Vocal iotada](#entry-35)\n*   [Letra Ьь — мягкий знак — Signo de suavidad](#entry-31)",
  "provider": "cloudflare-gemma",
  "model": "@cf/google/gemma-4-26b-a4b-it",
  "auditProvider": "",
  "auditModel": "",
  "promptVersion": "32.0",
  "generatedAt": "2026-09-19T08:22:27.745Z"
}
