{
  "code": "MLS-V04-0158",
  "language": "frances",
  "languageName": "Francés",
  "n": 158,
  "title": "Adjetivo normalmente pospuesto",
  "level": "A1",
  "part": "Determinación nominal — Détermination nominale",
  "chapter": "Adjetivos: concordancia y posición — Adjectifs : accord et position",
  "articleMarkdown": "#### En pocas palabras\n\nMuchos adjetivos franceses aparecen **después del nombre** que describen. Este orden es frecuente con adjetivos que indican color, forma, nacionalidad o características descriptivas específicas.\n\nPor ejemplo, en **une voiture rouge**, el nombre es *voiture* y el adjetivo **rouge** aparece después.\n\n#### Cómo funciona\n\nComo orientación básica, numerosos adjetivos descriptivos se posponen: **une table ronde**, **un livre intéressant**, **un restaurant italien**, **une chemise bleue**.\n\nLa posición después del nombre no cambia las reglas de concordancia. El adjetivo sigue ajustándose al género y al número del nombre: **une voiture rouge / des voitures rouges**.\n\n“Normalmente pospuesto” describe una tendencia de uso, no una regla absoluta aplicable a cualquier adjetivo. La posición depende del adjetivo concreto y, a veces, del significado que adopta en la frase.\n\n#### Ejemplos\n\n* **une voiture rouge** — un coche rojo.\n* **une table ronde** — una mesa redonda.\n* **un livre intéressant** — un libro interesante.\n* **des maisons blanches** — unas casas blancas.\n\n#### Observación importante\n\nNo conviene colocar un adjetivo después del nombre únicamente porque en español aparezca allí. Francés y español comparten algunos órdenes, pero no tienen exactamente la misma distribución.\n\nAdemás, ciertos adjetivos pueden aparecer antes o después con diferencias de matiz o significado. Por eso la posición habitual debe aprenderse junto con el uso del adjetivo.\n\n#### Entradas relacionadas\n\n[Femeninos irregulares beau/belle, nouveau/nouvelle, vieux/vieille](#entry-157) · [Adjetivo antepuesto y matiz](#entry-159) · [Femenino regular en -e](#entry-156) · [Adjetivos de color simples](#entry-160)",
  "provider": "mls-r32",
  "model": "editorial-standard-32",
  "auditProvider": "mls-r32-validator",
  "auditModel": "chat-draft-d783e3e6e7309dbeabae844374a4accee675ba33f32e60cbea8bdcfcdace4bd9",
  "promptVersion": "32.0",
  "generatedAt": "2026-09-19T07:22:01.379Z"
}
