{
  "code": "MLS-V09-0848",
  "language": "ruso",
  "languageName": "Ruso",
  "n": 848,
  "title": "он/она/оно anafóricos",
  "level": "C1",
  "part": "Referencia y predicación adjetival — Референция и адъективная предикация",
  "chapter": "Referencia, pronombres y anáfora — Референция, местоимения и анафора",
  "articleMarkdown": "#### Pronombres personales como referencia textual\n\nTimberlake (2004, § 4.5) describe los pronombres como recursos de **referencia textual** y los relaciona con la elipsis: su interpretación puede depender de información recuperable en el discurso previo. En esta función, un pronombre personal puede retomar un referente ya mencionado; la identificación concreta depende del contexto y de la concordancia gramatical.\n\n#### Referencia (APA 7)\n\nTimberlake, A. (2004). *A Reference Grammar of Russian*. Cambridge University Press. https://doi.org/10.1017/CBO9780511616373\n\n#### Entradas relacionadas\n\nConviene compararlo con el sujeto omitido en coordinación, con **свой** frente a **его/её/их** y con el orden de palabras de tema y foco. Todos estos fenómenos influyen en cómo el ruso mantiene y reactiva referentes a lo largo del discurso.",
  "provider": "mls-r32",
  "model": "editorial-standard-32",
  "auditProvider": "mls-r32-validator",
  "auditModel": "chat-draft-d87daee793448674343ad55ab7c6383a10b2b95f7cddc646f584decf6fb85673",
  "promptVersion": "32.0",
  "generatedAt": "2026-09-19T10:11:44.056Z"
}
