{
  "code": "MLS-V02-0159",
  "language": "portugues",
  "languageName": "Portugués brasileño",
  "n": 159,
  "title": "Isso",
  "level": "A1",
  "part": "Artículos, determinantes y cuantificación — Artigos, determinantes e quantificação",
  "chapter": "Determinantes, demostrativos y cuantificación — Determinantes, demonstrativos e quantificação",
  "articleMarkdown": "#### En pocas palabras\n\n**Isso** es un demostrativo neutro. En el sistema tradicional, suele señalar algo relacionado con el interlocutor o retomar una idea, situación o contenido ya mencionado.\n\nEn **Isso que você disse é importante**, *isso* recoge lo que la otra persona acaba de decir.\n\n#### Cómo funciona\n\n**Isso** no cambia por género ni número y no acompaña directamente a un sustantivo. Se dice **isso é verdade**, no *isso livro*.\n\nPuede señalar algo próximo al interlocutor: **O que é isso aí?** También funciona con mucha frecuencia como recurso discursivo para resumir o encapsular información anterior: **Ele perdeu o ônibus. Isso atrasou a reunião**.\n\nEn el sistema tradicional, **isto** se relaciona con el hablante, **isso** con el interlocutor o con información ya mencionada y **aquilo** con mayor distancia. En portugués brasileño cotidiano, **isso** tiene un uso muy amplio y puede ocupar contextos donde una descripción más conservadora distinguiría con mayor rigor entre *isto* e *isso*.\n\n#### Ejemplos\n\n* **Isso que você disse é importante.**  \n  *Isso* retoma el contenido expresado por el interlocutor.\n\n* **O que é isso aí?**  \n  El demostrativo señala algo situado cerca de la otra persona.\n\n* **A loja fechou cedo. Isso causou problemas.**  \n  *Isso* resume el hecho anterior completo.\n\n#### Observación importante\n\n**Isso** es neutro: no tiene formas masculina, femenina o plural. Su referencia puede ser un objeto, una situación, una idea o incluso una proposición completa.\n\nNo debe confundirse con **esse/essa**, que sí pueden acompañar directamente a un sustantivo: **esse livro**, **essa ideia**.\n\n#### Entradas relacionadas\n\n[157. Aquele, aquela, aqueles e aquelas](#entrada-157) · [158. Isto](#entrada-158) · [160. Aquilo](#entrada-160) · [161. Meu, minha, meus e minhas](#entrada-161) · [902. Isso como encapsulador discursivo](#entrada-902)",
  "provider": "mls-r32",
  "model": "editorial-standard-32",
  "auditProvider": "mls-r32-validator",
  "auditModel": "chat-draft-113252ce64ea783b9bc16e63d87e16c5ab918311c79c6afb8b9b957889f2b69d",
  "promptVersion": "32.0",
  "generatedAt": "2026-09-18T05:35:19.339Z"
}
